Submission ID,Respondent ID,Submitted at,id_tmdb,title,original_title,title,Id TMDB,channel,story_world,story_country_is_known,character1_residence_country,story_environment,"story_environment (En intérieur (habitation, lieu de travail...))","story_environment (En extérieur, dans un environnement plutôt urbain / densément peuplé)","story_environment (En extérieur, dans un environnement plutôt rural / peu densément peuplé)",story_environment (En pleine nature),story_environment (Dans un monde virtuel),"story_environment (Dans un ou des véhicules (bateau, train, avion, voiture, vaisseau spatial...))",story_environment (Autre),story_society_type,story_era,story_era (Entre la préhistoire et l'antiquité),story_era (Entre le moyen-âge et le XVIIIe siècle),story_era (Au XIXe siècle),story_era (Entre 1900 et 1950),story_era (Entre 1950 et 1980),story_era (Entre 1980 et 2000),story_era (Entre 2000 et 2010),story_era (Entre 2010 et 2020),story_era (Entre 2020 et 2030 ),story_era (Entre 2030 et 2050),story_era (Au-delà de 2050),story_era (Autre),character1_name,character2_name,character3_name,character4_name,character1_importance,character1_sentiment,character1_gender,character1_ethnic_origin,character1_interested_ecology,character1_residence_country_known,character1_residence_country,character1_residence_type,character1_residence_environment,character1_residence_size,character1_residence_state,character1_mobility_frequency,character1_mobility_vehicule [Voiture individuelle],character1_mobility_vehicule [Covoiturage],character1_mobility_vehicule [Transports en commun],"character1_mobility_vehicule [Mobilités douces (vélo, marche, etc.)]",character1_mobility_vehicule [VTC/Taxi],character1_mobility_vehicule [Chauffeur privé],character1_mobility_vehicule [Hélicoptère],character1_mobility_vehicule [Deux-roues motorisés],character1_mobility_vehicule [Autre],character1_mobility_long_distance,character1_mobility_long_distance_vehicule,character1_mobility_long_distance_vehicule (Voiture individuelle),character1_mobility_long_distance_vehicule (Covoiturage),character1_mobility_long_distance_vehicule (Train),character1_mobility_long_distance_vehicule (Avion commercial),character1_mobility_long_distance_vehicule (Avion privé),character1_mobility_long_distance_vehicule (Hélicoptère),character1_mobility_long_distance_vehicule (Autocar),character1_mobility_long_distance_vehicule (Bateau),character1_mobility_long_distance_vehicule (Chauffeur privé ),character1_mobility_long_distance_vehicule (Autre),character1_mobility_long_distance_vehicule_frequency [Voiture individuelle],character1_mobility_long_distance_vehicule_frequency [Covoiturage],character1_mobility_long_distance_vehicule_frequency [Train],character1_mobility_long_distance_vehicule_frequency [Avion Commercial],character1_mobility_long_distance_vehicule_frequency [Avion privé],character1_mobility_long_distance_vehicule_frequency [Hélicoptère],character1_mobility_long_distance_vehicule_frequency [Autocar],character1_mobility_long_distance_vehicule_frequency [Bateau],character1_mobility_long_distance_vehicule_frequency [Chauffeur privé],character1_mobility_long_distance_vehicule_frequency [Autre],character1_job_sector,character1_job,character1_job_role_in_story,character1_job_environment,character1_job_environment_sentiment,character1_technology_tools [Smartphone],character1_technology_tools [Ordinateur],character1_technology_tools [TV],character1_technology_tools [Tablette],character1_technology_tools [Console de jeux],character1_technology_tools [Objets connectés],character1_technology_tools [Robotique],character1_technology_tools [Autre],character2_importance,character2_sentiment,character2_gender,character2_age_group,character2_ethnic_origin,character2_interested_ecology,character2_residence_country_known,character2_residence_country,character2_residence_type,character2_residence_environment,character2_residence_size,character2_residence_state,character2_mobility,character2_mobility_vehicule [Voiture individuelle],character2_mobility_vehicule [Covoiturage],character2_mobility_vehicule [Transports en commun],"character2_mobility_vehicule [Mobilités douces (vélo, marche, etc.)]",character2_mobility_vehicule [VTC/Taxi],character2_mobility_vehicule [Chauffeur privé],character2_mobility_vehicule [Hélicoptère],character2_mobility_vehicule [Deux-roues motorisés],character2_mobility_vehicule [Autre],character2_mobility_long_distance,character2_mobility_long_distance_vehicule,character2_mobility_long_distance_vehicule (Voiture individuelle),character2_mobility_long_distance_vehicule (Covoiturage),character2_mobility_long_distance_vehicule (Train),character2_mobility_long_distance_vehicule (Avion commercial),character2_mobility_long_distance_vehicule (Avion privé),character2_mobility_long_distance_vehicule (Hélicoptère),character2_mobility_long_distance_vehicule (Autocar),character2_mobility_long_distance_vehicule (Bateau),character2_mobility_long_distance_vehicule (Chauffeur privé ),character2_mobility_long_distance_vehicule (Autre),character2_mobility_long_distance_vehicule_frequency [Voiture individuelle],character2_mobility_long_distance_vehicule_frequency [Covoiturage],character2_mobility_long_distance_vehicule_frequency [Train],character2_mobility_long_distance_vehicule_frequency [Avion Commercial],character2_mobility_long_distance_vehicule_frequency [Avion privé],character2_mobility_long_distance_vehicule_frequency [Hélicoptère],character2_mobility_long_distance_vehicule_frequency [Autocar],character2_mobility_long_distance_vehicule_frequency [Bateau],character2_mobility_long_distance_vehicule_frequency [Chauffeur privé],character2_mobility_long_distance_vehicule_frequency [Autre],character2_job_sector,character2_job,character2_job_role_in_story,character2_job_environment,character2_job_environment_sentiment,character2_technology_tools [Smartphone],character2_technology_tools [Ordinateur],character2_technology_tools [TV],character2_technology_tools [Tablette],character2_technology_tools [Console de jeux],character2_technology_tools [Objets connectés],character2_technology_tools [Robotique],character2_technology_tools [Autre],character3_importance,character3_sentiment,character3_gender,character3_ethnic_origin,character3_interested_ecology,character3_residence_country_known,character3_residence_country,character3_residence_type,character3_residence_environment,character3_residence_size,character3_residence_state,character3_mobility,character3_mobility_vehicule [Voiture individuelle],character3_mobility_vehicule [Covoiturage],character3_mobility_vehicule [Transports en commun],"character3_mobility_vehicule [Mobilités douces (vélo, marche, etc.)]",character3_mobility_vehicule [VTC/Taxi],character3_mobility_vehicule [Chauffeur privé],character3_mobility_vehicule [Hélicoptère],character3_mobility_vehicule [Deux-roues motorisés],character3_mobility_long_distance,character3_mobility_long_distance_vehicule,character3_mobility_long_distance_vehicule (Voiture individuelle),character3_mobility_long_distance_vehicule (Covoiturage),character3_mobility_long_distance_vehicule (Train),character3_mobility_long_distance_vehicule (Avion commercial),character3_mobility_long_distance_vehicule (Avion privé),character3_mobility_long_distance_vehicule (Hélicoptère),character3_mobility_long_distance_vehicule (Autocar),character3_mobility_long_distance_vehicule (Bateau),character3_mobility_long_distance_vehicule (Chauffeur privé ),character3_mobility_long_distance_vehicule (Autre),character3_mobility_long_distance_vehicule_frequency [Voiture individuelle],character3_mobility_long_distance_vehicule_frequency [Covoiturage],character3_mobility_long_distance_vehicule_frequency [Train],character3_mobility_long_distance_vehicule_frequency [Avion Commercial],character3_mobility_long_distance_vehicule_frequency [Avion privé],character3_mobility_long_distance_vehicule_frequency [Hélicoptère],character3_mobility_long_distance_vehicule_frequency [Autocar],character3_mobility_long_distance_vehicule_frequency [Bateau],character3_mobility_long_distance_vehicule_frequency [Chauffeur privé],character3_job_sector,character3_job,character3_job_role_in_story,character3_job_environment,character3_job_environment_sentiment,character3_technology_tools [Smartphone],character3_technology_tools [Ordinateur],character3_technology_tools [TV],character3_technology_tools [Tablette],character3_technology_tools [Console de jeux],character3_technology_tools [Objets connectés],character3_technology_tools [Robotique],character3_technology_tools [Autre],character4_importance,character4_sentiment,character4_gender,character4_age_group,character4_ethnic_origin,character4_interested_ecology,character4_residence_country_known,character4_residence_country,character4_residence_type,character4_residence_environment,character4_residence_size,character4_residence_state,character4_mobility_frequency,character4_mobility_vehicule [Voiture individuelle],character4_mobility_vehicule [Covoiturage],character4_mobility_vehicule [Transports en commun],"character4_mobility_vehicule [Mobilités douces (vélo, marche, etc.)]",character4_mobility_vehicule [VTC/Taxi],character4_mobility_vehicule [Chauffeur privé],character4_mobility_vehicule [Hélicoptère],character4_mobility_vehicule [Deux-roues motorisés],character4_mobility_long_distance,character4_mobility_long_distance_vehicule,character4_mobility_long_distance_vehicule (Voiture individuelle),character4_mobility_long_distance_vehicule (Covoiturage),character4_mobility_long_distance_vehicule (Train),character4_mobility_long_distance_vehicule (Avion commercial),character4_mobility_long_distance_vehicule (Avion privé),character4_mobility_long_distance_vehicule (Hélicoptère),character4_mobility_long_distance_vehicule (Autocar),character4_mobility_long_distance_vehicule (Bateau),character4_mobility_long_distance_vehicule (Chauffeur privé ),character4_mobility_long_distance_vehicule (Autre),character4_mobility_long_distance_vehicule_frequency [Voiture individuelle],character4_mobility_long_distance_vehicule_frequency [Covoiturage],character4_mobility_long_distance_vehicule_frequency [Train],character4_mobility_long_distance_vehicule_frequency [Avion Commercial],character4_mobility_long_distance_vehicule_frequency [Avion privé],character4_mobility_long_distance_vehicule_frequency [Hélicoptère],character4_mobility_long_distance_vehicule_frequency [Autocar],character4_mobility_long_distance_vehicule_frequency [Bateau],character4_mobility_long_distance_vehicule_frequency [Chauffeur privé],character4_job_sector,character4_job,character4_job_role_in_story,character4_job_environment,character4_job_environment_sentiment,character4_technology_tools [Smartphone],character4_technology_tools [Ordinateur],character4_technology_tools [TV],character4_technology_tools [Tablette],character4_technology_tools [Console de jeux],character4_technology_tools [Objets connectés],character4_technology_tools [Robotique],character4_technology_tools [Autre],environmental_issues,"environmental_issues_type [Le changement climatique (CO2, effet de serre, montée des océans, intensification des phénomènes météorologiques extrêmes...)]","environmental_issues_type [L'accès à l'eau (raréfaction, pollution...)]","environmental_issues_type [ La biodiversité (artificialisation des sols, disparition des habitats naturels, prolifération d'espèces parasites / envahissantes, effondrement des espèces)]","environmental_issues_type [L'épuisement des ressources (rareté des métaux, pénuries, augmentation des coûts d'extraction et des prix de vente)]","environmental_issues_type [Les contraintes énergétiques (fin des énergies fossiles, développement des sources renouvelables)]","environmental_issues_type [La pollution (micro-plastiques, produits chimiques...)]",biodiversity,biodiversity (Présence d'animaux domestiques ou d'élevage),biodiversity (Présence d'animaux sauvages),biodiversity (Personnification / anthropomorphisation d'animaux ou de végétaux),biodiversity (Présence de paysages naturels sauvages),"biodiversity (Présence d'espaces végétalisés aménagés (villes, jardins...))","biodiversity (Scènes de destruction du vivant (nature, animaux))",behaviors,behaviors (Vol en avion),"behaviors (Alimentation manifestement carnée, usage de barbecue)",behaviors (Autosolisme (personne seule dans une voiture)),behaviors (Scène d’achat / de consommation / de shopping épanouissant et positif),behaviors (Gaspillage alimentaire),behaviors (Placement de produits ou présence de marques à l’écran),behaviors (Utilisation de produits à usage unique),behaviors (Utilisation de piscine individuelle),"behaviors (Loisirs de type ski, moto, jet-ski, bateau à moteur, hélicoptère)","behaviors (Usage de transport en commun, vélo, mobilités actives)",behaviors (Alimentation manifestement végétarienne),behaviors (Recyclage / réparation / seconde main),"behaviors (Usage de gourdes, mugs et produits réutilisables)",behaviors (Temps important passé au contact de la nature),behaviors (Jardinage),behaviors (Cuisine maison),"behaviors (Loisirs type randonnée, bateau à voile, VTT, course à pied…)",ecological_impact,ecological_impact_film_score0,ecological_impact_film_score5,general_comment,general_comment,general_comment,respondent_age,respondent_gender,respondent_studies,respondent_ecological_awareness,respondent_postal_code,respondent_not_in_france,respondent_not_in_france (Je ne réside pas en France),respondent_country,respondent_email
4Pyp0B,4kgBxY,2024-04-12 15:30:20,915935,Anatomy of a Fall,Anatomie d’une chute,Anatomie d'une chute,,"Location / VOD (YouTube, MyCanal...)",Notre monde réel (incluant les mondes virtuels accessibles depuis notre monde réel),Oui,France,"En intérieur (habitation, lieu de travail...), En extérieur, dans un environnement plutôt rural / peu densément peuplé, En pleine nature",TRUE,FALSE,TRUE,TRUE,FALSE,FALSE,FALSE,Ni l'un ni l'autre: une société conforme au lieu et à l'époque du récit,Entre 2020 et 2030 ,FALSE,FALSE,FALSE,FALSE,FALSE,FALSE,FALSE,FALSE,TRUE,FALSE,FALSE,FALSE,Pierre,Paul,Jacques,Médor,Principal,Positive,Homme,Caucasien.ne,"Oui, systématiquement",Oui,Royaume-Uni,Maison individuelle,Plutôt rural,Adaptée,Neuve ou très récente,Beaucoup,Parfois,,,,Souvent,,,,,"Oui, un trajet (aller simple ou aller-retour)",Avion commercial,FALSE,FALSE,FALSE,TRUE,FALSE,FALSE,FALSE,FALSE,FALSE,FALSE,,,,,,,,,,,Administration publique,pompier,"Oui, c'est le sujet du récit",Oui,Positivement ,Occasionnellement,,Souvent,,,Occasionnellement,,Systématiquement,Secondaire,Neutre,Non binaire,Adolescent,Caucasien.ne,"Non, il / elle a même des comportements et valeurs explicitement anti-écologiques ",Oui,Suède,péniche,sur la lune,Je ne sais pas / je ne me souviens pas / ce n'est pas montré,Vétuste ou délabrée,Non,,,,,,,,,,"Oui, à plusieurs reprises",,,,,,,,,,,,Parfois,,,,Parfois,,,Souvent,,,"Transports, logistique",je ne sais pas,"Oui, ça participe aux enjeux de l'intrigue",Non,,,,,,,,,,Autre,Neutre,Non binaire,Asiatique,Non,Non,,Bateau / train / véhicule ,sur la lune,Je ne sais pas / je ne me souviens pas / ce n'est pas montré,Dans un bâtiment ancien non rénové,Un peu,Jamais,Parfois,Souvent,Souvent,Souvent,Souvent,Souvent,Souvent,Non,,,,,,,,,,,,,,,,,,,,,Administration publique,ewtwg,"Non, c'est accessoire",Je ne sais pas / je ne me souviens pas,,Pas du tout,Pas du tout,Pas du tout,Pas du tout,Pas du tout,Pas du tout,Pas du tout,Pas du tout,Secondaire,Positive,Vivant non-humain,Adolescent,Asiatique,"Oui, systématiquement",Non,,Appartement,"Urbain, grande ville",Adaptée,Dans un bâtiment ancien rénové,Un peu,Jamais,Jamais,Jamais,Jamais,Jamais,Jamais,Jamais,Jamais,Non,,,,,,,,,,,,,,,,,,,,,Administration publique,rgwhrh,"Oui, c'est le sujet du récit",Non,,Pas du tout,Pas du tout,Pas du tout,Pas du tout,Pas du tout,Pas du tout,Pas du tout,Pas du tout,Oui,Absent,Mentionné une fois,Mentionné à plusieurs reprises ,Joue un rôle dans le récit,Est le sujet du récit,Joue un rôle dans le récit,"Présence d'animaux sauvages, Présence d'animaux domestiques ou d'élevage",TRUE,TRUE,FALSE,FALSE,FALSE,FALSE,"Placement de produits ou présence de marques à l’écran, Cuisine maison",FALSE,FALSE,FALSE,FALSE,FALSE,TRUE,FALSE,FALSE,FALSE,FALSE,FALSE,FALSE,FALSE,FALSE,FALSE,TRUE,FALSE,2,Titanic,Chocolat,C'était bien,C'était pas bien,Non merci ça va,26 - 35 ans,Autre,Sans diplôme,5,6130,,,,mon adresse mail
yeKMMX,1E9raM,2024-04-18 11:35:04,915935,Anatomy of a Fall,Anatomie d’une chute,Anatomie d’une chute,,Salle de Cinéma,Notre monde réel (incluant les mondes virtuels accessibles depuis notre monde réel),Oui,France,"En intérieur (habitation, lieu de travail...), En extérieur, dans un environnement plutôt rural / peu densément peuplé, En pleine nature",TRUE,FALSE,TRUE,TRUE,FALSE,FALSE,FALSE,Ni l'un ni l'autre: une société conforme au lieu et à l'époque du récit,Entre 2020 et 2030 ,FALSE,FALSE,FALSE,FALSE,FALSE,FALSE,FALSE,FALSE,TRUE,FALSE,FALSE,FALSE,Sandra,Samuel ,,,Principal,Neutre,Femme,Caucasien.ne,Non,Oui,France,Maison individuelle,En pleine nature,Très grande,Dans de l'ancien plutôt en bon état,Un peu,Souvent,,,,,,,,,Non,,,,,,,,,,,,,,,,,,,,,,"Culture, art, spectacle, audiovisuel",Écrivaine,"Oui, c'est le sujet du récit",Non,,Souvent,Souvent,Occasionnellement,,,,,,Secondaire,Neutre,Homme,Adulte (30 - 50 ans),Caucasien.ne,Non,Oui,France,Maison individuelle,En pleine nature,Très grande,Dans de l'ancien plutôt en bon état,Un peu,Parfois,,,,,,,,,Non,,,,,,,,,,,,,,,,,,,,,,"Culture, art, spectacle, audiovisuel",écrivain,"Oui, c'est le sujet du récit",Non,,Souvent,Souvent,Occasionnellement,,,,,,,,,,,,,,,,,,,,,,,,,,,,,,,,,,,,,,,,,,,,,,,,,,,,,,,,,,,,,,,Adulte (30 - 50 ans),,,,,,,,,,,,,,,,,,,,,,,,,,,,,,,,,,,,,,,,,,,,,,,,,,,,Non,,,,,,,Présence d'animaux domestiques ou d'élevage,TRUE,FALSE,FALSE,FALSE,FALSE,FALSE,"Autosolisme (personne seule dans une voiture), Recyclage / réparation / seconde main, Temps important passé au contact de la nature",FALSE,FALSE,TRUE,FALSE,FALSE,FALSE,FALSE,FALSE,FALSE,FALSE,FALSE,TRUE,FALSE,TRUE,FALSE,FALSE,FALSE,4,,,,,,26 - 35 ans,Homme,"Bac+5 (Master, écoles d'ingénieur, écoles d'art)",5,75007,,,,
AA7dvB,lRrXxk,2024-04-19 10:18:28,597,Titanic,Titanic,Titanic,,Netflix,Notre monde réel (incluant les mondes virtuels accessibles depuis notre monde réel),Oui,Irlande,"Dans un ou des véhicules (bateau, train, avion, voiture, vaisseau spatial...)",FALSE,FALSE,FALSE,FALSE,FALSE,TRUE,FALSE,Ni l'un ni l'autre: une société conforme au lieu et à l'époque du récit,Entre 1900 et 1950,FALSE,FALSE,FALSE,TRUE,FALSE,FALSE,FALSE,FALSE,FALSE,FALSE,FALSE,FALSE,Rose,Jack,,,Principal,Positive,Femme,Caucasien.ne,Non,Non,,Je ne sais pas / je ne me souviens pas / ce n'est pas montré,Je ne sais pas / je ne me souviens pas / ce n'est pas montré,,,Un peu,Parfois,,,,,,,,,"Oui, un trajet (aller simple ou aller-retour)",Bateau,FALSE,FALSE,FALSE,FALSE,FALSE,FALSE,FALSE,TRUE,FALSE,FALSE,,,,,,,,,,,Rentier,Riche,"Non, c'est accessoire",Non,,,,,,,,,,Principal,Positive,Homme,Jeune adulte (moins de 30 ans),Caucasien.ne,Non,Non,,Je ne sais pas / je ne me souviens pas / ce n'est pas montré,Je ne sais pas / je ne me souviens pas / ce n'est pas montré,,,Non,,,,,,,,,,Non,,,,,,,,,,,,,,,,,,,,,,On ne sait pas,,,,,,,,,,,,,,,,,,,,,,,,,,,,,,,,,,,,,,,,,,,,,,,,,,,,,,,,,,,,,,,,,,,,,,Jeune adulte (moins de 30 ans),,,,,,,,,,,,,,,,,,,,,,,,,,,,,,,,,,,,,,,,,,,,,,,,,,,,Non,,,,,,,Présence de paysages naturels sauvages,FALSE,FALSE,FALSE,TRUE,FALSE,FALSE,,,,,,,,,,,,,,,,,,,2,,,,,,36 - 50 ans,Femme,"Bac+7 (Doctorat, thèse)",5,6130,,,,
1D4rQM,aGxYJX,2024-04-21 18:41:36,,,,Les choristes,,Salle de Cinéma,Notre monde réel (incluant les mondes virtuels accessibles depuis notre monde réel),Oui,France,"En intérieur (habitation, lieu de travail...), En extérieur, dans un environnement plutôt rural / peu densément peuplé, En pleine nature, Dans un ou des véhicules (bateau, train, avion, voiture, vaisseau spatial...)",TRUE,FALSE,TRUE,TRUE,FALSE,TRUE,FALSE,Ni l'un ni l'autre: une société conforme au lieu et à l'époque du récit,Entre 1900 et 1950,FALSE,FALSE,FALSE,TRUE,FALSE,FALSE,FALSE,FALSE,FALSE,FALSE,FALSE,FALSE,Pierre Morange,Clement Mathieu,,,Principal,Positive,Homme,Caucasien.ne,Non,Oui,France,Habitat communautaire ou alternatif,Plutôt rural,Exiguë,Dans de l'ancien plutôt en bon état,Non,,,,,,,,,,Non,,,,,,,,,,,,,,,,,,,,,,"Élève, étudiant",-,"Non, c'est accessoire",Non,,,,,,,,,,Principal,Positive,Homme,Adulte (30 - 50 ans),Caucasien.ne,Non,Oui,France,Habitat communautaire ou alternatif,Plutôt rural,Exiguë,Dans de l'ancien plutôt en bon état,Un peu,,,Parfois,,,,,,,"Oui, un trajet (aller simple ou aller-retour)",Autocar,FALSE,FALSE,FALSE,FALSE,FALSE,FALSE,TRUE,FALSE,FALSE,FALSE,,,,,,,,,,,"Éducation, enseignement, recherche",Surveillant,"Oui, c'est le sujet du récit",Non,,,,,,,,,,,,,,,,,,,,,,,,,,,,,,,,,,,,,,,,,,,,,,,,,,,,,,,,,,,,,,,,,,,Adolescent,,,,,,,,,,,,,,,,,,,,,,,,,,,,,,,,,,,,,,,,,,,,,,,,,,,,Non,,,,,,,"Présence d'espaces végétalisés aménagés (villes, jardins...)",FALSE,FALSE,FALSE,FALSE,TRUE,FALSE,"Alimentation manifestement carnée, usage de barbecue, Usage de transport en commun, vélo, mobilités actives",FALSE,TRUE,FALSE,FALSE,FALSE,FALSE,FALSE,FALSE,FALSE,TRUE,FALSE,FALSE,FALSE,FALSE,FALSE,FALSE,FALSE,4,James Bond,Into the wild,,,,26 - 35 ans,Femme,"Bac+5 (Master, écoles d'ingénieur, écoles d'art)",5,75009,,,,
Rvozql,M5OzZk,2024-04-21 18:41:42,,,,As bestas,,Salle de Cinéma,Notre monde réel (incluant les mondes virtuels accessibles depuis notre monde réel),Oui,Espagne,"En intérieur (habitation, lieu de travail...), En pleine nature",TRUE,FALSE,FALSE,TRUE,FALSE,FALSE,FALSE,Ni l'un ni l'autre: une société conforme au lieu et à l'époque du récit,Entre 2020 et 2030 ,FALSE,FALSE,FALSE,FALSE,FALSE,FALSE,FALSE,FALSE,TRUE,FALSE,FALSE,FALSE,Antoine,L’eleveur,,,Principal,Positive,Homme,Caucasien.ne,"Oui, systématiquement",Oui,Espagne,Maison individuelle,Plutôt rural,Grande,Dans de l'ancien plutôt en mauvais état,Un peu,Souvent,Parfois,Parfois,Parfois,Parfois,Parfois,Parfois,Parfois,Parfois,Non,,,,,,,,,,,,,,,,,,,,,,"Agriculture, alimentation, secteur animalier",Maraicher,"Oui, c'est le sujet du récit",Oui,Positivement ,Occasionnellement,Souvent,,Occasionnellement,Occasionnellement,Occasionnellement,Occasionnellement,Occasionnellement,Principal,Négative,Homme,Adulte (30 - 50 ans),Caucasien.ne,"Oui, ponctuellement",Oui,Espagne,Maison individuelle,Plutôt rural,Je ne sais pas / je ne me souviens pas / ce n'est pas montré,Je ne sais pas / je ne me souviens pas / ce n'est pas montré / non applicable,Un peu,Parfois,,Parfois,Souvent,Souvent,,Parfois,Parfois,Souvent,Non,,,,,,,,,,,,,,,,,,,,,,"Agriculture, alimentation, secteur animalier",Eleveur,"Oui, c'est le sujet du récit",Oui,Négativement,,,,,,,,,,,,,,,,,,,,,,,,,,,,,,,,,,,,,,,,,,,,,,,,,,,,,,,,,,,,,,,,,,Adulte (30 - 50 ans),,,,,,,,,,,,,,,,,,,,,,,,,,,,,,,,,,,,,,,,,,,,,,,,,,,,Oui,Joue un rôle dans le récit,Joue un rôle dans le récit,Joue un rôle dans le récit,Mentionné une fois,Est le sujet du récit,Mentionné une fois,"Présence d'animaux domestiques ou d'élevage, Présence de paysages naturels sauvages",TRUE,FALSE,FALSE,TRUE,FALSE,FALSE,"Autosolisme (personne seule dans une voiture), Recyclage / réparation / seconde main, Temps important passé au contact de la nature, Jardinage, Cuisine maison, Loisirs type randonnée, bateau à voile, VTT, course à pied…",FALSE,FALSE,TRUE,FALSE,FALSE,FALSE,FALSE,FALSE,FALSE,FALSE,FALSE,TRUE,FALSE,TRUE,TRUE,TRUE,TRUE,5,,,"Film super écolo, rapport à la nature ++, réflexion autour de la sobriété et du renouvelable",,,26 - 35 ans,Femme,"Bac+5 (Master, écoles d'ingénieur, écoles d'art)",5,75009,,,,
EvxVQL,8eedJx,2024-04-22 11:12:25,915935,Anatomy of a Fall,Anatomie d’une chute,Anatomie d’une chute,,Salle de Cinéma,Notre monde réel (incluant les mondes virtuels accessibles depuis notre monde réel),Oui,France,"En intérieur (habitation, lieu de travail...), En extérieur, dans un environnement plutôt rural / peu densément peuplé",TRUE,FALSE,TRUE,FALSE,FALSE,FALSE,FALSE,Ni l'un ni l'autre: une société conforme au lieu et à l'époque du récit,Entre 2020 et 2030 ,FALSE,FALSE,FALSE,FALSE,FALSE,FALSE,FALSE,FALSE,TRUE,FALSE,FALSE,FALSE,L'Héroïne,Le fils,,,Principal,C'est compliqué,Femme,Caucasien.ne,Non,Oui,France,Maison individuelle,Plutôt rural,Très grande,Neuve ou très récente,Non,,,,,,,,,,Non,,,,,,,,,,,,,,,,,,,,,,"Culture, art, spectacle, audiovisuel",Autrice,"Oui, ça participe aux enjeux de l'intrigue",Non,,Occasionnellement,Occasionnellement,Occasionnellement,,,,,,Principal,Positive,Homme,Adolescent,Caucasien.ne,Non,Oui,France,Maison individuelle,Plutôt rural,Très grande,Neuve ou très récente,Un peu,,Souvent,,Souvent,,,,,,Non,,,,,,,,,,,,,,,,,,,,,,"Élève, étudiant",Elève,"Non, c'est accessoire",Non,,Souvent,Souvent,,,,,,,,,,,,,,,,,,,,,,,,,,,,,,,,,,,,,,,,,,,,,,,,,,,,,,,,,,,,,,,,Senior (plus de 50 ans),,,,,,,,,,,,,,,,,,,,,,,,,,,,,,,,,,,,,,,,,,,,,,,,,,,,Non,,,,,,,"Présence d'animaux domestiques ou d'élevage, Présence de paysages naturels sauvages",TRUE,FALSE,FALSE,TRUE,FALSE,FALSE,"Recyclage / réparation / seconde main, Temps important passé au contact de la nature, Loisirs type randonnée, bateau à voile, VTT, course à pied…",FALSE,FALSE,FALSE,FALSE,FALSE,FALSE,FALSE,FALSE,FALSE,FALSE,FALSE,TRUE,FALSE,TRUE,FALSE,FALSE,TRUE,4,James Bond,As Bestas,"Retour à une vie proche de la nature et réparation, mode de vie plutôt sobre",Déplacement en voiture et aucune mention des enjeux écologiques + maison très grande ,,26 - 35 ans,Femme,"Bac+5 (Master, écoles d'ingénieur, écoles d'art)",5,75009,,,,
